Titulo,Empresa,Localizacion,Salario,Fecha_Publicacion,Valoracion_Empresa,Descripcion_Completa,Busqueda_Ciudad,Busqueda_Puesto
Auxiliar de Apoyo Equipo Asistencial Centro Residencial DomusVi Outeiro,DomusVi,España,No especificado,+ 30 d,"3,5","Descripción:

DomusVi es la compañía con la mayor red de centros y servicios sanitarios y sociales de atención a las personas mayores y de salud mental del país. El trato humano y familiar, la especialización sanitaria y el enfoque de confort y bienestar definen todos nuestros servicios.

En DomusVi, somos más de 28.000 profesionales y nos caracteriza nuestra cualificación, pasión y compromiso. Si estos son los valores que te definen, ¡te estamos buscando!

Nuestros valores definen a nuestro equipo. Promovemos un sentimiento de orgullo de pertenencia y ofrecemos un valor añadido a residentes y familias:

El saber cuidar: ponemos nuestros conocimientos, experiencia y humanidad al servicio de los cuidados.
El espíritu pionero: la innovación y las nuevas tecnologías forman parte de nuestro día a día.
La empatía innata: ponemos en valor la escucha activa y afectiva.
La confianza compartida: desarrolla tu carrera profesional desde la confianza plena y recíproca en las relaciones personales.
La sinceridad de las emociones: añade valor a tu trayectoria profesional siendo parte de la vida de nuestros/as residentes y usuarios/as.

Misión del puesto:

Dar apoyo al equipo asistencial en las funciones que le sean asignadas con el objetivo de garantizar la satisfacción de las personas usuarias del centro procurando en todo momento su bienestar y velando por la calidad en todos los detalles del servicio.

Funciones:

Servir comedores y recoger los menajes de los mismos.
Hacer las camas de los/as residentes.
Recoger la ropa de los/as residentes en las habitaciones para lavandería.
Efectuar la limpieza y mantenimiento básico de los utensilios propios de su labor.
Repartir los pedidos de material y garantizar su colocación.
Subir y bajar los carros a las diferentes plantas.
Ordenar los salones, así como prepararlos cuando sea necesario.

Ofrecemos:

Jornada completa
Turnos rotativos
Contrato temporal
Incorporación inmediata
Flexibilidad y compatibilización con las necesidades específicas de la persona seleccionada.

Requisitos:

Educación secundaria obligatoria
Recomendable formación complementaria en el ámbito de la gerontología y la dependencia.
Al menos 6 meses realizando funciones de iguales o similares características a las descritas.
Se valorará positivamente la disponibilidad de cursos de formación relacionados con el área así como formación complementaria en términos de fomento de la Igualdad.",Vigo,Todos
Consultor Seguridad Alimentaria y Calidad,AMBICAL Proyectos coru,España,No especificado,+ 30 d,"3,5","Fecha de la oferta: 21/07/2022

Seleccionamos: Consultor/a Seguridad Alimentaria y Calidad
– Para incorporación en plantilla en nuestra sede de A Coruña –

¿Quieres trabajar con los mejores Clientes?

¿Te apasiona la Calidad y la Seguridad Alimentaria?
¿Te apetecen nuevos retos?
Entonces, ¡AMBICAL es tu próximo reto!
Requisitos mínimos:
Experiencia mínima 2 años en consultoría en industria alimentaria en implantación de Normas.
Profundos conocimientos y experiencia demostrable en IFS / BRC / ISO 22000 / FSSC 22000.
Experiencia en auditorías de primera y segunda parte.
Referencias.
Funciones principales:
Diagnóstico e implantación de Normas. Asesoría a empresas de diversos sectores agroalimentarios.
Mejora continua de los Procesos y del Sistema de Gestión de la Seguridad Alimentaria y la Calidad.
Favorecer y garantizar el mantenimiento y mejora de sistemas ya implantados.
Auditar internamente y para segunda parte las normas y referenciales citados.
Impartir y desarrollar formación en las áreas de trabajo.
Favorecer y promover que los Clientes optimicen su nivel de Calidad y Seguridad Alimentaria.
Otros:
Jornada completa.
Empresa certificada EFR.
¿Subes?, aplica AQUÍ e indica Referencia Oferta CSAC, por favor.",Vigo,Todos
OPERARIO/A LIMPIEZA,Grupo Osga,España,No especificado,+ 30 d,"3,5","OPERARIO/A LIMPIEZA,EN A CORUÑA

En GRUPO OSGA estamos COMPROMETIDOS CON LA DIVERSIDAD, LA INCLUSION Y LA IGUALDAD DE TRATO Y DE OPORTUNIDADES y en contra cualquier tipo de discriminación.

Apostamos cada día y en cada puesto de trabajo, por la inclusión de personas de colectivos vulnerables en nuestros equipos de trabajo.

SOMOS PERSONAS QUE INTEGRAN A PERSONAS.

Esta oferta está dirigida a cualquier persona que reúna los requisitos técnicos y académicos exigidos, independientemente de su condición.

¡ÚNETE A GRUPO OSGA!

Categoría: Limpieza

¿Qué trabajo realizarás?

Limpieza de aulas y espacios comunes
Desinfección de superficies
Limpieza y mantenimiento de baños

¿Cuáles son los requisitos para este puesto?

Capacidad de trabajar de manera independiente y como parte de un equipo.
Conocimientos de productos de limpieza.
Capacidad para estar tiempo de pie, mover objetos ,arrodillarse etc .
Certificado de Discapacidad igual o superior al 33%.

¿Cuál será tu horario?

Informará la empresa

¿Cuál será tu contrato?:

Sustitución IT

¿Cuál será tu salario?:

Según convenio.

¿Cuándo empiezas?:

Informará la empresa

¿Dónde?:

Informará la empresa",Vigo,Todos
Camarera,Taberna del puerto ferrol,Ferrol,No especificado,10 días,"3,5","Camarera horario de 13.00 a 17.00 día y medio libre sueldo 880 + propinas (100-200€) aprox.

Tipo de puesto: Media jornada

Sueldo: 880,00€-1.100,00€ al mes

Ubicación del trabajo: Empleo presencial",Vigo,Todos
PERSONAL CONDUCCION CONTRATO INTERINIDAD FERROL,Arriva,España,No especificado,+ 30 d,"3,5","Seleccionamos personal de conducción de autobús para la zona Ferrol para realizar principalmente trasporte regular y escolar.

En Arriva fomentamos un entorno donde cada persona pueda desarrollarse plenamente, sin importar su género, orientación sexual, estado civil o de pareja, identidad de género, raza, religión o creencias, color, nacionalidad, origen étnico o nacional, discapacidad, edad, habilidades, experiencia, educación, situación socioeconómica o estilo de pensamiento.

Creemos acoger el talento diverso nos hace una empresa más fuerte y preparada para afrontar los desafíos presentes y futuros.",Vigo,Todos
Jefe/a de Carnicería,El Corte Inglés,España,No especificado,+ 30 d,"3,5","¿Buscas desarrollar tu talento y un lugar dónde tu esfuerzo sea reconocido? Te ofrecemos un entorno dinámico, cercano y de futuro. Aquí, cada día es una nueva oportunidad para aprender, crecer y brillar. Imagina formar parte de un equipo diverso, donde la evolución y el servicio al cliente son nuestra prioridad. En El Corte Inglés, nuestro trabajo es una pasión compartida.

El proyecto que te espera.
Ofrecerás una atención personalizada y de calidad al cliente, asesorándolo en su compra y fomentando la venta de productos frescos. Garantizarás una presentación atractiva del mostrador impulsando las ventas mediante un servicio proactivo y contribuirás a la fidelización del cliente a través de una experiencia de compra satisfactoria.
Funciones principales y requisitos.
Funciones:
Gestión y tratamiento de la mercancía.
Comercial y venta.
Correcta implantación del producto y su mantenimiento.
La atención, asesoramiento y venta de los productos y servicios.
Manejo de herramientas de corte y envasado para la realización de pedidos.
Montaje y desmontaje de mostradores y lineales.
Requisitos:
Experiencia mínima de un año 1 año.
Disponibilidad completa.
Te ofrecemos una variedad de beneficios sociales que contribuirán a tu bienestar.
Descuentos exclusivos y opciones de financiación.
Seguro de vida.
Universidad Corporativa.
Formación continua para el desarrollo profesional.
Ayudas al estudio para hijos e hijas de empleados.
Servicio Médico propio.
Ayudas para circunstancias personales o familiares concretas.
Plan de retribución flexible.
Si te resulta interesante este puesto, te invitamos a que apliques, ya que tu experiencia podría ser muy valiosa para nosotros. En nuestra empresa todas las personas son bienvenidas.",Vigo,Todos
Gestor/a de Punto de Venta - Temporal,Smollan Group,España,No especificado,6 días,"3,5","¡Únete a Smollan como Gestor/a de Punto de Venta (GPV)!

En Smollan, creemos firmemente que la fuerza de una empresa está en sus valores y en su equipo. Por eso contamos con una red de profesionales dinámicos que cuidan y miman la marca que representan. ¡Nos encanta lo que hacemos!

¿Eres una persona proactiva, con excelentes habilidades de comunicación y pasión por el mundo de las ventas? ¿Te gusta trabajar en equipo y te sientes cómodo/a en el canal de Gran Consumo? ¡Entonces te estamos buscando!

Actualmente, buscamos incorporar un/a Gestor/a del Punto de Venta (GPV) para visitar supermercados en la zona de MÁLAGA y alrededores.

Este es un proyecto TEMPORAL emocionante, enfocado en la gestión de un cliente líder en su sector, asegurando su visibilidad y rendimiento en los puntos de venta.

¿Qué harás en este puesto?

Como nuestro/a GPV, tus funciones principales serán:

Visitar los clientes asignados, gestionando y cumpliendo la ruta de forma eficiente.

Recopilar información valiosa del mercado para detectar tendencias y oportunidades.

Solucionar incidencias rápidamente: desde roturas de stock y falta de producto en el lineal, hasta problemas con el balizaje, cartelería promocional o mala implementación de campañas nacionales.

Optimizar el espacio en el lineal para asegurar la mejor exposición de los productos.

Detectar y proponer mejoras en cada punto de venta.

Negociar y ampliar el surtido para maximizar la presencia de la marca.


¿Eres la persona que buscamos?

Serás el/la candidato/a ideal si cuentas con:

Experiencia previa demostrable como Gestor/a de Punto de Venta.

Sólida experiencia en negociación comercial.

Experiencia como comercial en el canal de alimentación.

Carné de conducir vigente.

Excelentes habilidades comunicativas y capacidad de negociación.

Dinamismo y gran capacidad de organización.

Disponibilidad de incorporación para finales de Marzo.


¿Qué te ofrecemos?

Si te unes a nuestro equipo, disfrutarás de:

Contrato TEMPORAL a jornada completa.

Remuneración con fijo + variable, además de coche de empresa y dietas.

La oportunidad de formar parte de una compañía en pleno crecimiento, trabajando con marcas líderes en el mercado.

Si estás list@ para asumir un nuevo reto emocionante y crees que tienes la chispa que buscamos para impulsar nuestras marcas, ¡no lo dudes más! ¡Únete a nuestro equipo como Gestor/a de Punto de Venta y forma parte de nuestro éxito! ¡Estamos deseando conocerte!",Vigo,Todos
Animación,Samay Resorts,España,No especificado,+ 30 d,"3,5","Forma parte de Samay
Somos un gran equipo de profesionales de una de las empresas líder del sector en la Costa Blanca y el resto del país. Trabajamos cada día para ofrecer una gran calidad de nuestras instalaciones junto con una cuidada atención al cliente. Pertenecer a un proyecto en constante evolución y mejora genera una gran ilusión y responsabilidad en las personas que formamos parte de él.



Si te encanta entretener, bailar y crear sonrisas, ¡esta es tu oportunidad de brillar y formar parte de una experiencia emocionante!",Vigo,Todos
AUXILIAR DE ALMACEN (H/M) TEMPORAL,Micofer by Empatif,España,No especificado,+ 30 d,"3,5","Descripción:

Desde Micofer By Empatif seleccionamos perfil de AUXILIAR DE ALMACEN (H/M) para empresa ubicada en el polígono de Bergondo.

Funciones:

Supervisar la carga y descarga de mercancía.
Verificar la salida diaria de pedidos.
Coordinar los procesos logísticos.

Se ofrece:

Contratación temporal desde el 17.12.2025 hasta el 29.12.2025 con posibilidad de continuidad en otras empresas a través de Micofer By Empatif.
Contratación directamente por empresa.
Horario continuo de 07:00 a 15:00 o de 08:00 a 16:00 en función de la llegada de mercancía.

Requisitos:

Experiencia previa trabajando en funciones de almacén (preparación de pedidos, gestión de albaranes, etc).
Posibilidad de desplazamiento diario hasta Bergondo.
Perfil de persona organizada, metódica y con atención al detalle.",Vigo,Todos
OPERARIO CERCEDA (H/M),Micofer by Empatif,España,No especificado,+ 30 d,"3,5","Descripción:

Desde Micofer buscamos para importante empresa especializada en diferentes productos del mar, personal para línea de alimentación.

Funciones:

Alimentación de la línea de producción hasta el paletizado.
Manipulado del producto, limpieza y envasado.

Se ofrecen:

Contratación a jornada completa.
Salario según convenio.
Horario intensivo (8:00h a 17:00h) de lunes a viernes.

Requisitos:

Experiencia en puestos similares.
Disponibilidad para incorporación inmediata.
- Disponibilidad horaria para trabajar de Lunes a Viernes en horario de 8:00h -17:00h (1hora para comer)

Posibilidad para desplazarse al centro de trabajo ubicado en Cerceda.",Vigo,Todos
Asistente personal,Domestiko,España,No especificado,+ 30 d,"3,5","Se busca asistente personal para domicilios en Friol, Lugo. El puesto implica brindar apoyo a una persona dependiente que puede deambular sola. Las funciones incluyen asistencia en tareas personales puntuales y ayuda con las tareas del hogar, donde se prevé una mayor carga de trabajo.

También se requerirá acompañamiento. Se ofrecerá un contrato laboral temporal con jornada parcial, principalmente durante las mañanas. Es indispensable contar con permiso de conducir tipo B.

Se valorará experiencia previa en puestos similares, aunque no es imprescindible que sea extensa, admitiéndose experiencia menor a un año.",Vigo,Todos
Carretillero retráctil,CYCLE SERVICIOS,España,18 mil € - 20 mil € (Proporcionado por la empresa),+ 30 d,"3,5","Cycle Servicios Integrales CE


Boiro (Santa Eulalia) (A Coruña)



Experiencia

Al menos 1 año de experiencia

Salario

Entre 18.000 y 20.000€ Brutos/anuales

Área - Puesto

Compras, logística y transporte

Carretillero/a
Inventarista
Mozo/a de Almacén
Categoría o nivel

Empleado/a

Vacantes

1

Inscritos

298

Contrato

Contrato De duración determinada

Jornada

Completa


Proceso de selección continuo.

Funciones

-cargas y descargas de camiones -Colocación de palets en estanterías moviles -embalado y flejado de palets

Requisitos

-Tener en vigor el carnet de carretillero y experiencia mínima de 1 año. -Disponibilidad de incorporación inmediata. -Tener disponibilidad para trabajar a turno partido de lunes a viernes de 08:00-13:00 y 15:00-18:00

Se ofrece

contrato eventual por 6 meses posibilidad de ampliación de contrato a 1 año",Vigo,Todos
Vendedor/a Ferretería Temporal 30h Tardes La Coruña,Leroy Merlin,España,No especificado,22 días,"3,5","Nuestras Tiendas es el lugar donde demostramos, cara a cara, nuestro propósito. Si compartes este objetivo y tu satisfacción es conseguir que los clientes puedan dar vida a sus ideas y proyectos, este es tu sitio.

Formar parte del equipo de nuestras tiendas significa trabajar en un ambiente de co-creación donde vivir nuestros valores y propósito de empresa junto al cliente.

¿Te unes a nosotros y nosotras?

Te lo enseñamos aquí en este vídeo:

Por esto contamos contigo como Vendedor/a Especialista, porque tienes un amplio conocimiento de tu oficio y nuestros productos, aportas la experiencia de trabajar como profesional de tu sector y sobre todo tienes pasión por lo que haces.

Principales funciones

Ofrecer un asesoramiento completo al habitante, en su ámbito de actuación, con el objetivo de alcanzar la satisfacción y fidelización del mismo.
Asesorar al habitante, a través del canal adecuado en cada momento, con el objetivo de ofrecerle los productos / servicios que más se ajusten a sus necesidades.
Atender al habitante con diligencia y resolver las incidencias y dudas que puedan darse durante todo el proceso de venta, personalizando y ofreciendo experiencias de compra positivas.
Detectar oportunidades de negocio en todas las interacciones con el habitante, y aprovecharlas teniendo en cuenta siempre los criterios de margen y rentabilidad para Leroy Merlin, realizando los presupuestos y los pedidos asociados, y llevando a cabo un seguimiento de los mismos.
Ofrecer a los habitantes los servicios más adaptados a la venta solución como la instalación, financiación y envíos a domicilio entre otros gestionando los pagos en el punto de venta cuando la ocasión lo permita.
Realizar la gestión administrativa de los servicios postventa de cara a prestar un servicio idóneo para el habitante.


¿Qué ofrecemos?

Nuestro Propósito

En Leroy Merlin tenemos un propósito que da sentido a lo que somos y a todo lo que hacemos, una guía que es nuestro compromiso contigo y con el planeta. Y es que todo lo que te ofrecemos busca despertar en ti la motivación de crear entornos donde vivir mejor.

Porque estamos seguros de una cosa, si nos lo proponemos, cambiar el mundo está en nuestras manos y en las tuyas.

La Acción Social es uno de los pilares fundamentales de Leroy Merlin España, siendo un valor añadido para toda la empresa, pero también para la comunidad. A través de diversas acciones: proyectos de reforma y acondicionamiento, donaciones, productos solidarios, voluntariado corporativo y nuestra Convocatoria de Ayudas ""Hogares Dignos"", contribuimos a la construcción de un mundo y de una sociedad mejor.

¡Benefíciate! Por ser Leroy Merlin

Como colaboradora o colaborador de Leroy Merlin España tienes a tu disposición más de 70 beneficios y/o ventajas clasificados en 6 categorías, pensados para brindarte la mejor experiencia por ser parte de este gran equipo.

Te beneficiarás además de la Política de Compensación Flexible y de Beneficios ofrecidos por Leroy Merlin, como son la posibilidad de convertirte en accionista de la compañía, Seguro de Salud, ayudas en guardería, cheques restaurante y diversos descuentos con grandes colaboradores comerciales, entre otros.

Contarás con una retribución fija además de la participación en los resultados y beneficios.

¡Desarróllate!

¡Fórmate y desarróllate en una empresa multinacional! Encontrarás un gran ambiente de trabajo y dispondrás de autonomía para decidir y actuar, pudiendo participar en la toma de decisiones y en proyectos transversales.

El lugar para todas y todos

La Gestión de la Diversidad es un eje fundamental en nuestra filosofía de empresa. Es por esto que está incluida en el Chárter de Diversidad, un código de compromiso promovido por la Fundación para la Diversidad y apoyado por el Ministerio de Sanidad, Política Social e Igualdad. Con esto, nos reafirmamos en nuestro compromiso con el respeto al derecho de la inclusión de todas las personas y reconocemos los beneficios que nos brindan la diversidad cultural, demográfica y social.

Leroy Merlín España, S.L.U., declara su compromiso en el establecimiento y desarrollo de políticas que integren la igualdad entre mujeres y hombres, sin ningún tipo de discriminación, así como en el impulso y fomento de medidas para conseguir la igualdad efectiva en el seno de nuestra organización. Asumimos el principio de igualdad entre mujeres y hombres en todos y cada uno de los ámbitos en los que se desarrolla nuestra actividad y en el marco de la Responsabilidad social de nuestra Organización.

Si quieres desarrollar el trabajo que te gusta, nuestra puerta está abierta para ti. Aquí no entendemos de barreras.

TU TALENTO NO TIENE LÍMITES

Sí quieres conocer más información acerca de nuestro Propósito, valores y acciones y nuestras vacantes de empleo, dejamos a tu disposición nuestra Web de Empleo Corporativa Leroy Merlin España.

¡CAMBIAR NUESTRO MUNDO ESTÁ EN NUESTRAS MANOS!",Vigo,Todos
Auditoría Junior A Coruña Septiembre 2026,Deloitte,España,No especificado,+ 30 d,"3,5","¿Te imaginas participando en la transformación de las principales organizaciones nacionales e internacionales?

En Deloitte estamos comprometidos con generar un impacto en la sociedad, en nuestros clientes y en ti.

¿Cuál es el reto?

Como Auditor Junior, formarás parte de un equipo de trabajo que te permitirá aprender y contribuir desde el primer día. Participarás en diferentes proyectos de auditoría, ayudando a mejorar procesos en las diferentes áreas del negocio. En tu día a día, trabajarás con grandes profesionales, analizarás datos de los clientes a los que seas asignado, entenderás el negocio de las compañías en distintos sectores e industrias y tu trabajo aportará valor los procesos de transformación y cambio de las organizaciones.

¿Que funciones desarrollarías?


Aprender y poner en práctica la auditoría real: Participarás en proyectos de auditoría que desafían tus habilidades y conocimientos y que te permitirán crecer cada día, entender los distintos negocios y sus efectos en la información financiera.
Colaborar con equipos multidisciplinares: Trabajarás de cerca con los profesionales de las empresas cliente y otros equipos de Deloitte nacionales e internacionales para analizar procesos e identificar riesgos.
Contribuir en el análisis de las áreas de riesgo de la auditoría asegurando que cumplan con las normativas y estándares profesionales aplicables, así como la presentación de hallazgos, conclusiones y recomendaciones.
Ayudar a mejorar controles y procedimientos: Usarás tus conocimientos para identificar áreas de oportunidad y proponer ideas para hacer las cosas más eficientes.
Aprender de los expertos: Estarás en contacto directo con profesionales y altos directivos, que te guiarán y te ayudarán a convertirte en un experto también.
¿Qué buscamos en ti?

Perfil académico: Esta oportunidad está dirigida a estudiantes de último curso o recién graduados en áreas de business que quieran dar sus primeros pasos en el sector.

Pasión por aprender: No se necesita que seas un experto, solo que tengas muchas ganas de crecer en el mundo profesional y conocer el negocio de la auditoría, así como los recursos digitales más innovadores en análisis de datos.

Trabajo en equipo: en Deloitte no trabajamos solos, forma parte de nuestro ADN colaborar para alcanzar grandes resultados.

Actitud positiva y proactiva: Nos encanta trabajar con personas que toman la iniciativa y están comprometidas con su equipo y que quieran generar impacto.

Pensamiento analítico y atención al detalle: es fundamental cuestionarse constantemente la información que recibimos para asegurar que se obtienen todos los datos relevantes. Solo evaluándola de manera crítica y profunda es posible brindar el mejor servicio y ofrecer un asesoramiento sólido que facilite una toma de decisiones acertada.

Incorporación en septiembre 2026.

¿Cómo es trabajar en Deloitte?

Proyectos de alto impacto donde tendrás un largo recorrido y aprendizaje

️ Un día a día híbrido-flexible: tendrás horario flexible y un buen equilibrio entre el teletrabajo y el trabajo en equipo en nuestras oficinas o las de nuestros clientes

Buen ambiente dentro y fuera de la oficina: disfrutarás de varios teambuildings al año, actividades culturales y deportivas… ¡y mucho más!

‍ ️ Bienestar integral: cuídate con nuestro programa de salud física, mental y financiera… ¡y con equipo médico en las oficinas!

Impacto social: Podrás apuntarte a una gran cantidad de voluntariados de alcance nacional e internacional y a proyectos pro-bono con los que poner tu tiempo y talento al servicio de quienes más lo necesitan

️Cultura del feedback y aprendizaje continuo: crecerás en un entorno inclusivo donde la igualdad de oportunidades y tu plan personalizado de formación impulsarán tu desarrollo. ¿Ya te visualizas en la Deloitte University de París?

Beneficios exclusivos por ser parte de Deloitte: podrás disfrutar de un gran catálogo de beneficios y de un completo plan de retribución flexible

Si te gusta lo que lees, estos son tus próximos pasos:
Aplica a la oferta haciendo clic en ‘Enviar candidatura ahora’ y completa tu perfil
Si encajas en el puesto, nuestro equipo de talento te contactará para conocerte mejor

¡Comienza el proceso! Te iremos guiando por las diferentes fases hasta tu incorporación.

Deloitte es una Firma de servicios profesionales firmemente comprometida con la igualdad de oportunidades. En este sentido, la Firma aceptará y tramitará solicitudes de todos los sectores de la sociedad, no discriminando por motivos de sexo, expresión de género, raza, religión o creencias, origen étnico o nacional, discapacidad, enfermedad o condición de salud, predisposición genética a sufrir patologías, edad, ciudadanía, estado civil, orientación o identidad sexual, situación socioeconómica o cualquier otra condición o circunstancia personal o social.
Ubicación: La Coruña
Tipo de puesto: Estudiantes y Recién Titulados
Línea de servicio: AUDIT & ASSURANCE
Req Id: 46062",Vigo,Todos
