Titulo,Empresa,Localizacion,Salario,Fecha_Publicacion,Valoracion_Empresa,Descripcion_Completa,Busqueda_Ciudad,Busqueda_Puesto
Auxiliar de Productos Frescos (Charcutería),Carrefour,Torrelavega,No especificado,3 días,"3,9","¡Hola! ¡Queremos conocerte!
¿Te apasiona el mundo del comercio? ¿Te preocupas por los detalles? ¿Te consideras una persona dinámica? ¡Te estábamos esperando!
Carrefour es una empresa líder en comercio de alimentación y distribución y queremos que inicies una carrera profesional llena de posibilidades con nuestros mejores profesionales.
Pretendemos que todos los días sean un aprendizaje, que crezcas y llegues tan lejos como quieras. Te ofrecemos formación a cargo de la empresa y la posibilidad de promocionar internamente para seguir creciendo con nosotros.
¿Qué buscamos?
Que nuestros clientes quieran volver y para ello hay que empezar por nuestros colaboradores. Nuestro objetivo es encontrar personas con don de gentes, dinámicas, con capacidad de aprendizaje y a las que les guste trabajar en equipo.
Los productos frescos son primordiales en los centros de alimentación y para los clientes, por eso te ocuparás de proporcionar el mejor servicio de estos productos, con la teatralización de los mismos, asegurando al cliente la mejor calidad y frescura para su compra.
Como profesional de los productos frescos en la sección de CHARCUTERÍA, las funciones propias del puesto serán:

Corte y despacho del producto.
Montaje del mostrador.
Reposición para la imagen de la sección.
Control de mermas.
Mantenimiento y promoción del género.
Limpieza e higiene de la sección.
Orientación y asesoramiento al cliente.
Nos encantará conocerte si cuentas con:

Educación Secundaria Obligatoria (formación mínima requerida).
Habilidades: orientación al cliente, trabajo en equipo, proactividad.
Conocimientos sobre los productos que venden en la sección y su preparación.
Se valora la experiencia previa en puestos similares.
Incorporación a una gran compañía donde podrás crecer.
Descuento del 8% para ti y para 6 personas más en todos nuestros productos.
Formación continua para desarrollarte profesionalmente.
Programas que se preocupan por tu bienestar: Carrefour Life (actividades y eventos deportivos, descuentos y ventajas exclusivas).

En Carrefour apostamos por un espacio de trabajo idóneo para que cualquier persona con independencia de su género, orientación sexual, identidad y/o expresión de género, creencias, ideologías, origen, capacidades, entre otras, pueda desplegar todo su potencial.",Santander,Todos
TORRELAVEGA LIMPIEZA ¡Entra a para formar parte de nuestro equipo de LIMPIEZA! McDonald´s Torrelavega · Torrelavega,McDonald's,Torrelavega,No especificado,+ 30 d,"3,9","Vive la experiencia de trabajar en McDonald's.

¿Qué buscamos?

Experiencia previa en limpieza de equipos de cocina o áreas similares.
Capacidad para seguir instrucciones y trabajar de forma autónoma.
Compromiso con los estándares de limpieza y seguridad de McDonald's.
Satisfacción por el trabajo bien hecho.
Trabajo en equipo. Buen ambiente de trabajo y compañerismo en nuestros restaurantes.

¿Te ves reflejado/a?

Estas son las ventajas de trabajar con nosotros:

Contrato de trabajo indefinido a tiempo parcial
Formación a cargo de la empresa

McDonald's, el trabajo que va contigo




Se valorará experiencia en limpieza de cocinas profesionales y equipamiento de restauración. Adjuntar CV.",Santander,Todos
Auxiliar PMR,Domestiko,Torrelavega,No especificado,10 días,"3,9","Se busca persona para realizar acompañamiento y asistencia a viajeros con movilidad reducida en Torrelavega. Las tareas incluirán ayudarles a acceder a sus trenes, ubicarlos correctamente, y recogerlos desde su vehículo hasta el punto de partida.

También se ofrecerá ayuda y soporte con el equipaje de los pasajeros. Esto abarca tanto el transporte y la asistencia en su colocación en los compartimentos habilitados dentro del tren.

Se ofrece una jornada laboral de 8 horas semanales, con un horario rotativo de lunes a domingo, cubriendo los turnos de 5:06 a 14:30 y de 14:30 a 23:52, según cuadrante, respetando los descansos legales. Se requiere un nivel de usuario en informática para el manejo de dispositivos electrónicos como PDAs y smartphones.",Santander,Todos
Limpiador/a Camping - 40H F/M,Yelloh! Village Punta Marina,España,No especificado,9 días,"3,9","Camping Punta Marina - Isla, Cantabria

El Camping Punta Marina es un pequeño camping de 120 parcelas situado en la costa cántabra, en el norte de España.




Tareas


Limpieza de las zonas comunes (bloques sanitarios, tienda, sala de espectáculos, recepción, sala de juegos, etc.) – asegurarse de que siempre se queden limpias
Limpieza de los bungalows
⁠
Preparación de los bungalows tras el invierno
⁠
Mantener el almacén organizado y limpio⁠
Controlar y reponer productos de limpieza (realizar listas de pedidos)
Gestión del inventario en los bungalows (identificar lo que falta)
Reponer artículos necesarios en los alojamientos
Hacer camas si es necesario o entregar kits de sábanas, toallas y kit bebés
⁠
Preparar las sábanas para la lavandería
Utilizar el sistema informático del camping (Companion) para organizar la limpieza de los alojamientos
⁠
Mantener un buen ambiente entre los equipos
⁠
Llevar la ropa del camping puesta y su credencial





Particularidades:

Trabajo en jornada partida con dos días consecutivos de descanso y trabajo los fines de semana

Amplitud horario : 8:00 - 22:00

No se puede coger vacaciones sobre la duracion del contrato

Perfil buscado:

Rigor y cuidado: es necesario trabajar de forma limpia y meticulosa para obtener un resultado que agrade a los campistas

Respeto del reglamento interno, de las instrucciones dadas por la dirección y puntualidad

Espíritu de equipo: es un trabajo en el que el avance y la eficacia dependen tambien del trabajo de los demás

Buen trato con los clientes (idiomas: inglés o francés son un plus)",Santander,Todos
Camarera/ Camarero de Pisos,Isla Bella Beach Resort,España,No especificado,23 días,"3,9","Hotel Isla Bella Spa


Isla (Cantabria)



Experiencia

Al menos 2 años de experiencia

Salario

Retribución sin especificar

Área - Puesto

Hostelería, Turismo

Camarero/a de Pisos
Categoría o nivel

Empleado/a

Vacantes

1

Inscritos

3


Proceso de selección continuo.

Funciones

Realización de tareas de limpieza en habitaciones de hotel

Requisitos

Se requiere experiencia previa demostrable en puesto similar. Máxima atención al detalle, eficiencia y eficacia en el trabajo. Turno en horario de mañana. Es imprescindible contar con permiso de conducir y vehículo para poder desplazarse. Abstenerse de enviar CV si no se cumplen las características solicitadas

Se ofrece

Condiciones a concretar en entrevista personal, según la valía y experiencia del candidato. Incorporación inmediata",Santander,Todos
"NUEVA TIENDA NOJA Pescadería, carnicería, frutería y caja/reposición",BM Supermercados,España,No especificado,7 días,"3,9","En BM Supermercados buscamos personas para las secciones de caja y reposición, pescadería, carnicería, frutería y panadería… pero no a cualquiera.

Si te entusiasma ayudar y tratar con clientes, lograr que la experiencia de compra sea impecable y disfrutas de un trabajo dinámico donde cada detalle cuenta, entonces: queremos conocerte.

Qué ofrecemos

Formación inicial a cargo de la empresa .

Contrato indefinido a 30h/semanales, con posibilidad de aumentar horas.

Ofrecemos diferentes turnos y opciones horarias según la disponibilidad y necesidades del equipo .

Condiciones salariales competitivas, por encima de la media del sector .

Ambiente de trabajo cercano, dinámico y con apoyo constante del equipo.

Desarrollo dentro de la empresa.

Ventajas sociales : descuentos en compras, sesiones de masaje preventivo, bono de navidad, servicios de salud, etc.

Tu día a día

Atender y cobrar a los/as clientes/as en caja, siempre con una actitud positiva y embolsando la compra para ofrecer la mejor experiencia de compra en BM Supermercados.

Reponer y organizar los productos en las estanterías, así como revisar las fechas de caducidad.

Mantener el orden, la limpieza y la buena imagen del supermercado.

Según las necesidades de la tienda y en determinadas épocas del año (campañas, verano, vacaciones o picos de venta), prestarás apoyo en la sección en la que hayas sido previamente formado/a: pescadería, carnicería, frutería o panadería.

Qué buscamos

Personas activas, responsables y con ganas de aprender.

Excelente trato y comunicación con personas clientes, así como buena actitud para el trabajo en equipo .

Flexibilidad horaria para adaptar turnos o ampliar horas en caso de incidencias o refuerzos .

Se valora muy positivamente tener vehículo propio para facilitar los desplazamientos .

Contar con experiencia previa en puestos de caja, reposición o atención al cliente es relevante, así como en secciones (pescadería, carnicería, frutería o panadería), aunque no imprescindible. Lo más importante para nosotros es la actitud y las ganas de aprender.

Ubicación: Noja

Buscamos personas que quieran crecer, afrontar nuevos retos y compartir nuestra pasión por la atención al cliente y la excelencia en supermercados.

Únete a BM Supermercados.",Santander,Todos
Carretillera/o sector industrial,Domestiko,Torrelavega,No especificado,+ 30 d,"3,9","Se busca profesional con experiencia en el manejo de carretillas elevadoras para un entorno industrial en Torrelavega, Cantabria. Las responsabilidades principales incluyen la operación de carretillas para cargar, descargar y mover mercancías dentro de las instalaciones. También se encargará de asegurar el almacenamiento y la organización adecuada de los productos en el almacén, respetando siempre las normas de seguridad y calidad.

Es necesario contar con al menos dos años de experiencia previa en manejo de carretillas en ambientes industriales. El candidato deberá poseer un carnet de carretillero/a vigente y demostrar conocimiento en el uso de carretillas frontales. Se requiere flexibilidad para trabajar en turnos rotativos, jornada partida, y disponibilidad para laborar fines de semana y días festivos.

La posición ofrece una remuneración competitiva y la oportunidad de unirse a un equipo profesional y dinámico. En este entorno laboral se fomenta el trabajo en equipo y el crecimiento personal de sus integrantes.",Santander,Todos
Auxiliares de limpieza,Domestiko,España,No especificado,+ 30 d,"3,9","Se necesitan dos auxiliares de limpieza para un establecimiento hotelero en Puente Viesgo.

Las tareas a realizar incluyen la limpieza de cocinas, fregadero, cazuelas, planchas, suelos y campanas extractoras. También se manejará el lavavajillas industrial. Se ofrece un contrato laboral indefinido a jornada completa, trabajando de lunes a domingo con dos días libres seguidos.

El salario se ajustará al convenio aplicable, con recompensas adicionales por festivos trabajados. Se dispondrá de comedor para el personal, incluyendo comida o cena según el turno. Se valorará experiencia previa en limpieza de instalaciones similares, aunque no es un requisito indispensable. Es preferible residir cerca del lugar de trabajo.",Santander,Todos
CAMARERO,GRUPO TCT CANTABRIA,Santander,No especificado,10 días,"3,9","CAMARERO

Somos Grupo TCT Cantabria S.L., un grupo empresarial de hostelería en Cantabria, con varios establecimientos en la ciudad de Santander.

Tareas a realizar:
Manejo de bandeja, servicio en mesa y destreza en barra.
Conocimientos básicos de TPV.
Buena actitud, agilidad y trato amable con el público.
Capacidad para trabajar en equipo y bajo ritmo dinámico.
Disponibilidad para trabajar fines de semana y turnos según necesidades del servicio.
Perfil:
Disponibilidad para trabajar fines de semana y turnos según necesidades del servicio.
Disponibilidad inmediata (preferente, no excluyente).
Qué te ofrecemos:
Contrato y condiciones según el Convenio de Hostelería de Cantabria.
Incorporación rápida una vez seleccionado/a el candidato/a.
Jornada y turnos organizados según la operativa del negocio.
Estabilidad laboral según valía y desempeño.
Ambiente de trabajo profesional y buen compañerismo.",Santander,Todos
Desarrollador Web,watt · sec,Santander,No especificado,+ 30 d,"3,9","Puedes enviarnos tu curriculum a info@wattsec.com



Su responsabilidad principal será el análisis e implementación de aplicaciones web basadas en tecnologías como HTML, Javascript o PHP y usando CMS. Para ello se valorará:

Conocimientos de HTML y CSS.
Conocimientos de Javascript y Typescript.
Programación PHP
Conocimientos de Wordpress/Woocommerce u otros CMS/E-Commerce

También se tendrá en cuenta los siguientes aspectos:

Formación académica en materias relacionadas con el desarrollo de software.
Experiencia previa en trabajos similares.
Conocimiento de inglés.",Santander,Todos
AYUDANTE DE ALMACÉN EN TIENDA DE MODELISMO Y WARGAMES,Creaciones Hupamar,Torrelavega,17 mil € (Proporcionado por la empresa),16 días,"3,9","Ofrecemos un puesto de trabajo para gestión de almacén con las funciones de recepción de mercancía, preparación de pedidos, gestión de stock, control de calidad, realización de inventario…

Se valoran positivamente conocimientos en el sector del modelismo, maquetismo y Wargames.

Se valorará experiencia previa en Ecommerce (Prestashop).

Se requiere conocimientos de informática a nivel usuario (paquete office).

Se requiere conocimientos medios de inglés.

Buscamos una persona responsable, comprometida, organizada y dinámica.

No se requiere experiencia previa.

Tipo de puesto: Jornada completa

ADJUNTAR CARTA DE PRESENTACIÓN

Tipo de puesto: Jornada completa

Sueldo: A partir de 17.000,00€ al año

Educación:

Primaria (Obligatorio)

Experiencia:

comercio: 1 año (Deseable)
E-commerce: 1 año (Deseable)

Idioma:

Inglés (Deseable)

Ubicación del trabajo: Empleo presencial",Santander,Todos
Trabajadores en la preparación de pescado para conservas,Domestiko,España,1 mil € (Proporcionado por la empresa),+ 30 d,"3,9","Se buscan personas con experiencia en la preparación de pescado para conservas, específicamente en el fileteado de anchoa. Se valorará un mínimo de 24 meses de experiencia en esta labor para cubrir puestos de oficial de segunda.

Las jornadas de trabajo habituales son de lunes a viernes. Sin embargo, si llega pesca fresca que requiera procesamiento inmediato, se podría requerir la incorporación en fines de semana. Estos días extra de trabajo se compensarían con días de descanso adicionales según lo establecido legalmente. El horario habitual es de 8:30 a 13:00 y de 15:00 a 18:00, con posibilidad de acordar horarios alternativos si ambas partes están de acuerdo.

Se ofrece un contrato fijo-discontinuo con un salario de 1.456€, regido por el convenio colectivo de conservas, semiconservas y salazones.",Santander,Todos
DEPENDIENTE/A BURGER KING SANTANDER CC VALLE REAL ref RDPND,Burger King,Santander,No especificado,+ 30 d,"3,9","Descripción:

¡En Burger King® necesitamos de tu talento!

Si quieres contribuir a que el fuego de nuestras parrillas no cese, ¡ahora es tu oportunidad!

¿Te gustaría trabajar en un entorno dinámico con oportunidades reales de hacer carrera profesional? ¡Has encontrado tu lugar!

Buscamos personal para nuestro restaurante del Centro Comercial Valle Real (Santander).

¿Qué necesitamos de ti?

Habilidades para atender a nuestros clientes como nadie.
Trabajar en equipo con el talento de nuestras cocinas.
Ganas, ganas y más ganas de aprender, ¡nunca es suficiente!

¿Cómo será tu día a día en Burger King®?

Atenderás a nuestros clientes y te encargarás del cobro en la caja.
Cocinar nuestras hamburguesas para que todos nuestros clientes disfruten del auténtico sabor a la parrilla.
Preparar pedidos para todos nuestros canales de venta: sala, take away y delivery.
Tareas de reposición y limpieza en nuestros restaurantes.

¿Qué te ofrecemos a cambio?

Plan de carrera: Posibilidad de realizarte en una gran empresa de restauración en plena expansión y desarrollo a nivel nacional. ¡Podrás llegar a gerente en poco más de un año si cumples con el plan estipulado y existe una vacante en alguno de nuestros establecimientos!
Modalidad de contrato: Indefinido con diferentes tipos de jornadas.
Horarios adaptables: Turnos rotativos.
Salario: Según convenio
Disfrutar de la Retribución Flexible de RB Europe (ticket restaurante, transporte, guardería, etc.), una plataforma llena de beneficios para que ahorres mensualmente.
Beneficiarte de un pack de descuentos y experiencias solo por ser de RB Europe (descuentos de grupo y otras promociones).

En Burger King estamos comprometidos con la igualdad, y por ello promovemos ambientes de trabajo basados en el respeto a las personas, fomentando el desarrollo profesional de nuestros/as trabajadores/as garantizando en todo momento la igualdad de oportunidades. Nos preocupamos en ofrecer y mantener un entorno de trabajo libre de cualquier discriminación por motivo de género, edad, orientación sexual, religión, etnia o cualquier otra circunstancia personal o social.

Si eres un/a auténtico/a fan del Whopper® y quieres formar parte de un proyecto laboral retador, ¡no dudes más y envíanos tu solicitud!




Requisitos:

Residencia en zona cercana al centro de trabajo.
Orientación al Cliente.
Capacidad para el trabajo en equipo.",Santander,Todos
Camarero/a polivalente 30h,Accor,Santander,No especificado,24 días,"3,9","Descripción de la empresa


Por qué trabajar para Accor?


Somos mucho más que un líder mundial. Te damos la bienvenida tal como eres y puedes encontrar un trabajo una marca que coincida con tu personalidad.
Te apoyamos para que crezcas y aprendas cada día, asegurándonos de que el trabajo le dé propósito a tu vida, para que durante tu viaje con nosotros, puedas seguir exporando las posibilidades ilimitadas de Accor.
Al unirte a Accor, cada capítulo de tu historia es suyo para escribir y juntos podemos imaginar la hospitallidad del mañana. Descubre la vida que te espera en Accor, visita https://careers.accor.com/
¡Haz lo que amas, cuida el mundo, atrévete a desafiar el status quo! #BELIMITLESS


Descripción del empleo


Hotel Ibis Styles Santander busca incorporar a su equipo un/a camarero/a polivalente, con experiencia en servicio de desayunos, cafetería/restaurante y apoyo a otras áreas del hotel. Buscamos a una persona dinámica, responsable y con vocación de servicio al cliente


Requisitos


Funciones principales:

Atender y servir a clientes en desayunos, cafetería y restaurante así como apoyo en otros departamentos.
Mejorar la experiencia y satisfacción del huésped.
Coordinar las tareas de apertura y cierre.
Mantener el orden, limpieza y presentación de las áreas de trabajo cumpliendo con los estándares de calidad.
Seguir las políticas y procedimientos acordados en toda la propiedad.
Brindar un servicio excelente que supere las expectativas del cliente.
Seguir los estándares y procedimientos operativos.
Manejo de efectivo y ayuda en la gestión del inventario.
Tener constante conocimiento de producto, menús e iniciativas del hotel.
Preparación y presentación de alimentos y bebidas según los estándares establecidos.

Requisitos:

Lo que buscamos…

Capacidad para realizar múltiples tareas, trabajar en un entorno dinámico y mantener una alta atención al detalle.
Excelentes habilidades de comunicación verbal y escrita. Dominio del español e inglés.
Habilidad para generar un impacto positivo en el equipo, los huéspedes y los colegas.
Facilidad para construir relaciones, trabajar con otros equipos y líderes con pasión por alcanzar metas conjuntas.
Capacidad de trabajo en equipo y polivalencia.
Adaptabilidad y aprendizaje rápido dentro de empresa.

Información adicional


Que puede ofrecerte nuestra compañía:

La oportunidad de unirse a un grupo internacional innovador y de rápido crecimiento, comprometido no sólo con la construcción de nuevos hoteles, sino con la construcción de una marca global.
La oportunidad de desafiar la norma y trabajar en un entorno creativo y gratificante.
Formar parte de un equipo al que le apasiona crear grandes experiencias de hospitalidad y explorar nuevas ubicaciones en cada oportunidad.
Un paquete competitivo y muchas oportunidades de desarrollo.
Excelentes descuentos en toda la familia de nuestras marcas.",Santander,Todos
Asistente domiciliario,Domestiko,Santander,No especificado,+ 30 d,"3,9","Se buscan profesionales para brindar apoyo y acompañamiento en el hogar a personas que lo necesiten. Las tareas incluirán asistencia en actividades cotidianas, ayuda con la higiene personal y el aseo, seguimiento y administración de medicación pautada, preparación de alimentos adaptados y supervisión general.

Es fundamental contar con experiencia previa en el cuidado de personas mayores. Se valorarán conocimientos básicos de higiene personal, técnicas de movilización para personas con movilidad reducida y nociones de primeros auxilios. Disponer de un certificado de profesionalidad en atención sociosanitaria o una formación equivalente será un punto a favor.

Se ofrece una oportunidad laboral estable con un contrato indefinido a jornada completa. El horario de trabajo se establecerá de mutuo acuerdo. La remuneración se basará en lo estipulado por convenio.",Santander,Todos
"LIMPIEZA DE OFICINAS EN LOS CORRALES, SEVILLA",Domestiko,Los Corrales,No especificado,27 días,"3,9","Buscamos a una persona para cubrir una vacante EVENTUAL POR EXCEDENCIA como limpiador/a de una OFICINA en la población de LOS CORRALES 41657 SEVILLA

¿A quién buscamos?

A una persona con la siguiente experiencia:
Haber realizado trabajos en limpieza
Conocimientos sobre utilización de productos de limpieza
Limpieza y mantenimiento de Cristales
Comprender instrucciones escritas y habladas
Ser honesto y responsable.

¿Qué te ofrecemos?

Contrato: INDEFINIDO
Fecha Inicio: INMEDIATA
Jornada: 3 horas semanales
Horario: LUNES MIERCOLES Y VIERNES 1H DE 09H A 10H
Salario: según convenio (aprox 90-95€/mensuales)
DIRECCIÓN; AV. DE ANDALUCIA 41657 LOS CORRALES, SEVILLA

Haber realizado trabajos en limpieza
Conocimientos sobre utilización de productos de limpieza
Limpieza y mantenimiento de Cristales
Comprender instrucciones escritas y habladas
Ser honesto y responsable.",Santander,Todos
BACKOFFICE (Atención al cliente energía),Konecta Group,Camargo,No especificado,+ 30 d,"3,9","¿Estás dispuesto/a a sacar tu máximo potencial de nuestra mano? ¡Queremos acompañarte en el proceso paso a paso!
Somos una empresa comprometida con la igualdad de oportunidades entre mujeres y hombres, apostando por la igualdad en todas nuestras posiciones.
Confiamos en nuestros equipos, fomentamos su bienestar y las posibilidades de desarrollo profesional y, ¡nos encantará contar contigo!

En esta ocasión, los únicos requisitos son: Empatía, Comunicación y ganas de aprender.
Las personas que se unan a nosotros/as tendrán la oportunidad de conocer desde dentro el funcionamiento de una reconocida empresa de comunicación.

Te contamos lo que nos gustaría ofrecerte:

Onboarding mediante formación desde el día 7 al 23 de enero de 9:00 a 15:00h
Contrato 30 horas/semana
Horario del puesto: mañana 9h a 15h o de tarde 15h a 21h (a elegir)
Lugar: Av. Juan Carlos I s/n Camargo, Cantabria (39600)
Salario: 1062€ brutos/mes
Posibilidad de seguir formándote a través de un catálogo de cursos a tu disposición.
Promociones y movimientos internos.
Club beneficios Konecta (portal exclusivo en el que podrás ahorrar en tus compras en ofertas y descuentos que hemos preparado con mucho mimo para ti)
Incorporación al puesto: 26 de enero

¡Únete a la empresa líder de servicios de Customer Experience!



Ortografía
Compresión lectora
Empatía
Ofimática",Santander,Todos
Conductor/a de furgoneta de reparto,Domestiko,Torrelavega,No especificado,+ 30 d,"3,9","Se busca un/a profesional responsable para un puesto de conductor/a de furgoneta de reparto en una empresa consolidada dentro del sector de la alimentación. La incorporación se realizará directamente en plantilla, buscando un compromiso a largo plazo.

La posición requiere contar con el permiso de conducir tipo B en vigor. Se trata de una oferta de contrato laboral indefinido, con una jornada completa de 40 horas semanales. El horario de trabajo está establecido de lunes a viernes, permitiendo así una organización semanal predecible.",Santander,Todos
