Titulo,Empresa,Localizacion,Salario,Fecha_Publicacion,Valoracion_Empresa,Descripcion_Completa,Busqueda_Ciudad,Busqueda_Puesto
Conductor profesional rutas nacionales e internacionales,Domestiko,España,No especificado,24 horas,"3,9","Se busca un conductor profesional con experiencia demostrable en rutas tanto nacionales como internacionales para cubrir trayectos por España y, especialmente, Francia. La responsabilidad principal será la conducción segura y eficaz de vehículos pesados, incluyendo aquellos con remolque frigorífico. Será esencial mantener la cadena de frío y gestionar la carga correctamente, además de manejar la documentación de transporte como albaranes y CMR, cumpliendo siempre con la normativa vigente. El estricto cumplimiento de los tiempos de conducción y descanso, junto con el mantenimiento preventivo del vehículo, son requisitos fundamentales.

Se necesita una experiencia previa de al menos dos años en un puesto similar. Son imprescindibles los conocimientos en logística de frío, la normativa del tacógrafo y la conducción eficiente. Además, es obligatorio contar con el carnet de conducir C + E y el certificado CAP en vigor. La remuneración será competitiva, con un salario base, pluses por kilometraje, dietas internacionales y nocturnidad. La planificación de rutas se diseñará para facilitar la conciliación familiar, con retornos programados.

El puesto ofrece estabilidad laboral dentro de una empresa sólida y en expansión. Trabajarás con una flota moderna y bien equipada. Contarás con un entorno de trabajo colaborativo y comunicación directa con el departamento de tráfico para resolver cualquier incidencia de forma rápida. Se requiere una persona responsable, organizada y adaptable, con un fuerte compromiso con la seguridad y la eficiencia en el transporte. El contrato será temporal con posibilidad de indefinido.

Experiencia mínima de 2 años en conducción profesional, preferiblemente con vehículos pesados y remolque refrigerado. Permiso de conducir C + E y Certificado de Aptitud Profesional (CAP) en vigor. Conocimientos en logística de frío, normativa de tacógrafo y conducción eficiente. Educación Secundaria Obligatoria o Ciclo Formativo. Capacidad para gestionar documentación de transporte (albaranes, CMR). Responsabilidad en el cumplimiento de tiempos de conducción y descanso. Habilidad para el mantenimiento básico del vehículo.",Santander,Todos
Técnico/a de Control de Ejecución,WSP,Santander,No especificado,+ 30 d,"3,9","Únete a WSP: proyectos técnicos de alto nivel

En WSP somos referentes mundiales en ingeniería especializada en infraestructuras, transporte, energía, medio ambiente y edificación. Trabajamos en proyectos emblemáticos donde tus conocimientos técnicos se pondrán a prueba en entornos exigentes y de alto valor añadido.


Debido al fuerte crecimiento en nuestra área de Transporte e Infraestructuras | WSP, queremos incorporar en nuestro equipo Asistencia técnica en Obra | WSP en Santander a un/a Ingeniero/a de Caminos, Canales y Puertos , para Asistencia Técnica en obra Portuaria.

¿Qué harás con nosotros?

Entre tus funciones principales estarán realizar el seguimiento a pie de obra y labores como técnico de control; realizar reuniones periódicas con la dirección de obra; trabajos de gestión de documentación y redacción de informes técnicos.

¿Qué buscamos en ti?

Buscamos un/a profesional con titulación en ICCP, con más de 10 años de experiencia como jefe de obra, jefe de producción, jefe de asistencia técnica o técnico de control, y experiencia en gestión y coordinación de documentación de obra.

El/la Candidato/a seleccionado/a deberá permanecer en la obra asignada durante la ejecución de la misma

¿Qué te ofrecemos?

Incorporación a un equipo técnico con proyectos reales desde el primer día
Jornada flexible y plan de formación continua
Acompañamiento de perfiles senior y entorno de aprendizaje real
Retribución flexible y acceso a beneficios para empleados/as

¡Da el primer paso!

Si quieres empezar tu carrera profesional con un equipo que te exija, te apoye y te permita crecer desde el minuto uno, postúlate y construyamos juntos tu trayectoria.

Nuestro proceso de selección:

1. Entrevista telefónica: Una primera conversación breve para conocerte mejor y hablar sobre tu experiencia y expectativas.

2. Entrevista técnica y personal: Te reunirás con nuestro equipo de captación de talento y con el responsable del área para evaluar conjuntamente tus habilidades técnicas y tu encaje en el equipo.

3. Entrevista final: Conversarás con la Dirección de la Unidad de Negocio sobre tu potencial rol y cómo encaja con nuestra visión estratégica.

Sobre nosotros:

Somos una firma global líder en ingeniería y servicios profesionales. Cuando buscas un cambio, es fundamental elegir un lugar donde puedas crecer profesionalmente y encajar con tus valores. Nuestros equipos están comprometidos con generar un impacto real y duradero en las comunidades en las que trabajamos, impulsando una cultura de excelencia técnica, innovación e inclusión.

Promovemos activamente la diversidad y la igualdad de oportunidades, convencidos de que las diferencias enriquecen nuestro trabajo y fortalecen nuestros resultados. Todas las candidaturas serán tratadas con la máxima confidencialidad y consideración.

Únete al equipo y descubre lo que puedes lograr con nosotros.

#SomosWSP

#LI-EM2",Santander,Todos
Development Technician,BSH Hausgeräte,Santander,No especificado,10 días,"3,9","Tomorrow is our home.

See how easy it is to explore new ideas at BSH Home Appliances Group: As a leading manufacturer of home appliances, we improve people’s quality of life by thinking in solutions. With our global brands Bosch, Siemens, Gaggenau and Neff as well as our local brands, we explore innovative technologies from voice recognition to artificial intelligence. As we utilize these to create new user experiences, we think, prototype, build – and keep on learning. Join us now and give your career a home.

Development Technician

BSH Electrodomésticos España, S.A. | Full time |
Santander",Santander,Todos
Gerocultor/a - Auxiliar de enfermería Centro Residencial DomusVi Stella Maris,DomusVi,Santander,No especificado,8 días,"3,9","Descripción:

En DomusVi, cuidar es compartir humanidad, es crecer como profesional y formar parte de una labor que trasciende el día a día.

Buscamos profesionales que quieran ejercer con vocación, en un entorno donde la empatía, la innovación y el respeto forman parte de cada jornada.

¿Por qué DomusVi?

Porque somos la mayor red de centros y servicios sociosanitarios en España, con más de 28.000 profesionales comprometidos/as.

Trabajamos desde una visión cercana, profesional y humana, donde importa cada persona —usuario/a, trabajador/a, familiar.

Nuestros valores nos definen:

El saber cuidar: ponemos conocimientos y humanidad al servicio del cuidado y en el bienestar.
Espíritu pionero: la innovación y la tecnología son parte de nuestro día a día.
Empatía innata: valoramos la escucha activa y afectiva.
Confianza compartida: promovemos relaciones basadas en el compromiso y la confianza mutua.
Sinceridad de las emociones: aportamos autenticidad a cada vínculo.

Lo que vas a encontrar en DomusVi

Una cultura centrada en el cuidado y respeto de las personas usuarios/as, trabajadores/as, familias)
Un equipo interdisciplinar y colaborativo que te acompaña, escucha y con el que poder desarrollarte.
Estabilidad laboral y condiciones adaptadas a tus necesidades.
Tiempo para dedicar a lo que más importa: la atención de calidad.
Espacios para desarrollarte y crecer profesionalmente.

¿Qué harás como Gerocultor/a - Auxiliar de enfermería?

Cumplimiento de la ruta de trabajo según el protocolo de cuidados a residentes estipulado por el/la Coordinador/a de Enfermería (cambios de postura, higiene diaria, etc).
Ayudar al/a la usuario/a en su autonomía personal y en su inserción en la vida social del centro.
Dar de comer a aquellos/as residentes que no puedan hacerlo por sí mismos y supervisar la autoalimentación de los que pueden. Servir desayunos, comidas, meriendas y/o cenas según le sea indicado por su superior/a.
Responsabilizarse de la correcta hidratación de los/as residentes en todo momento.
Hacer las camas de los/as residentes, así como recoger la ropa de las habitaciones.
Administrar aquella medicación oral a los/as residentes que le sea indicada por enfermería. Excluyendo en todo caso aquella medicación específica de riesgo como mórficos y otros.
Colaborar en el trabajo asistencial del centro.
Coordinar y ayudar a los/as residentes en sus desplazamientos a las terapias o actividades que tengan que realizar.
Tutorización de alumnado en prácticas.

Lo que te ofrecemos:

Contrato: 1 indefinido (4 horas en turno de mañana), 1 correturnos en turno de tarde y 2 contratos de sustitución por vacaciones.
Jornada: Parcial (4 h) y completa (correturnos y sustituciones).
Turnos: turnos de mañana, tarde y noche según puesto y cobertura.
Incorporación: inmediata
Ambiente de trabajo: colaborativo y respetuoso
Conciliación laboral
Formación continua, Beneficios Sociales y Desarrollo Profesional: lo que te permitirá crecer en empresa en constante evolución.

Requisitos:

Ciclo Formativo FP Cuidados Auxiliares de Enfermería, Ciclo Formativo FP Atención a Personas en Situación de Dependencia o CP Atención Sociosanitaria a Personas Dependientes en Instituciones Sociales.
Deseable experiencia mínima de 6 meses en puesto similar.
Formación complementaria en el ámbito gerontológico, manipulación de alimentos o similar.
Se valorará positivamente la disponibilidad de cursos de formación relacionados con el área así como formación complementaria en términos de fomento de la Igualdad.

¿Te gustaría trabajar en un lugar donde tu vocación y tu desarrollo profesional van de la mano?

En DomusVi, compartimos humanidad y cuidamos tanto de quienes atendemos como de quienes forman parte de nuestro equipo.

¡Te esperamos!",Santander,Todos
Comercial de terreno,Domestiko,España,No especificado,+ 30 d,"3,9","Se busca una persona con experiencia para incorporarse a un equipo comercial de campo. Tus responsabilidades incluirán la búsqueda activa de nuevos clientes y oportunidades de negocio mediante visitas presenciales, ofreciendo asesoramiento técnico experto sobre las soluciones de telecomunicaciones disponibles. También te encargarás de la gestión comercial integral, la elaboración de presupuestos detallados y el reporte periódico de tus ventas.

Este puesto ofrece un contrato indefinido a jornada completa, con un horario de lunes a viernes de 9:00 a 18:00, incluyendo una hora para el almuerzo. Es indispensable contar con al menos un año de experiencia previa en ventas o comercialización, idealmente en el sector de las telecomunicaciones.

Se valorarán conocimientos técnicos en redes, comunicaciones y tecnologías de la información. Asimismo, es imprescindible disponer de carné de conducir y titulación académica de ESO o equivalente. La remuneración bruta anual se sitúa en 20.000 euros.",Santander,Todos
Ayudante/a de mantenimiento y bandas transportadoras - Cantabria,Masanés Servindustria,España,20 mil € (Proporcionado por la empresa),30 días,"3,9","¿Tienes experiencia en mantenimiento industrial y bandas transportadoras? ¡Esta es tu oportunidad!

En nuestra empresa, especializada en instalación, reparación y mantenimiento de maquinaria industrial y cintas transportadoras, abrimos una nueva vacante para incorporar a una persona dinámica, comprometida y con ganas de aportar valor a nuestro equipo.

Formarás parte de un equipo técnico que se encarga de:

Instalación de maquinaria industrial y cintas transportadoras en sector industrial (granjas, plantas de reciclaje, canteras, cementeras, industria alimentaria, etc.).
Reparaciones mecánicas tanto de maquinaria como de bandas y sus componentes.
Mantenimiento preventivo y correctivo en las instalaciones de nuestros clientes.

Por nuestra parte ofrecemos:

Contrato indefinido.
Plan de formación y retribución flexible.
Un entorno de trabajo donde se valora tu iniciativa, tu implicación y tu evolución.

Valoraremos especialmente:

Experiencia en sector industrial y trabajos en altura y/o espacios confinados.
Experiencia en soldadura, mecánico ajustador y calderería, etc.
Experiencia en bandas transportadoras.
Responsabilidad, actitud proactiva, seriedad y trabajo en equipo.

Súmate a nuestro equipo

Si te motiva la idea de desarrollar un oficio técnico, resolver retos cada día y crecer dentro de una empresa sólida, ¡te estamos esperando!",Santander,Todos
Gerocultor/a - Auxiliar de enfermería Centro Residencial DomusVi Liencres,DomusVi,España,No especificado,+ 30 d,"3,9","Descripción:

En DomusVi, cuidar es compartir humanidad, es crecer como profesional y formar parte de una labor que trasciende el día a día.

Buscamos profesionales que quieran ejercer con vocación, en un entorno donde la empatía, la innovación y el respeto forman parte de cada jornada.

¿Por qué DomusVi?

Porque somos la mayor red de centros y servicios sociosanitarios en España, con más de 28.000 profesionales comprometidos/as.

Trabajamos desde una visión cercana, profesional y humana, donde importa cada persona —usuario/a, trabajador/a, familiar.

Nuestros valores nos definen:



El saber cuidar: ponemos conocimientos y humanidad al servicio del cuidado y en el bienestar.
Espíritu pionero: la innovación y la tecnología son parte de nuestro día a día.
Empatía innata: valoramos la escucha activa y afectiva.
Confianza compartida: promovemos relaciones basadas en el compromiso y la confianza mutua.
Sinceridad de las emociones: aportamos autenticidad a cada vínculo.

¿Qué harás como Gerocultor/a - Auxiliar de enfermería?

Cumplimiento de la ruta de trabajo según el protocolo de cuidados a residentes estipulado por el/la Coordinador/a de Enfermería (cambios de postura, higiene diaria, etc).
Ayudar al/a la usuario/a en su autonomía personal y en su inserción en la vida social del centro.
Dar de comer a aquellos/as residentes que no puedan hacerlo por sí mismos y supervisar la autoalimentación de los que pueden. Servir desayunos, comidas, meriendas y/o cenas según le sea indicado por su superior/a.
Responsabilizarse de la correcta hidratación de los/as residentes en todo momento.
Hacer las camas de los/as residentes, así como recoger la ropa de las habitaciones.
Administrar aquella medicación oral a los/as residentes que le sea indicada por enfermería. Excluyendo en todo caso aquella medicación específica de riesgo como mórficos y otros.
Colaborar en el trabajo asistencial del centro.
Coordinar y ayudar a los/as residentes en sus desplazamientos a las terapias o actividades que tengan que realizar.
Tutorización de alumnado en prácticas.

Lo que te ofrecemos:


Contrato: temporal
Jornada: completa
Turnos: de noche 22:00-08:00
Incorporación: inmediata
Ambiente de trabajo: colaborativo y respetuoso
Conciliación laboral
Formación continua, Beneficios Sociales y Desarrollo Profesional: lo que te permitirá crecer en empresa en constante evolución.

Requisitos:

Ciclo Formativo FP Cuidados Auxiliares de Enfermería, Ciclo Formativo FP Atención a Personas en Situación de Dependencia o CP Atención Sociosanitaria a Personas Dependientes en Instituciones Sociales.
Deseable experiencia mínima de 6 meses en puesto similar.
Formación complementaria en el ámbito gerontológico, manipulación de alimentos o similar.
Se valorará positivamente la disponibilidad de cursos de formación relacionados con el área así como formación complementaria en términos de fomento de la Igualdad.

¿Te gustaría trabajar en un lugar donde tu vocación y tu desarrollo profesional van de la mano?

En DomusVi, compartimos humanidad y cuidamos tanto de quienes atendemos como de quienes forman parte de nuestro equipo.

¡Te esperamos!",Santander,Todos
"Óptico en Santander, C.C. Valle Real",Multiopticas,Santander,No especificado,21 días,"3,9","¿Te apasiona la Óptica y la Optometría? Si deseas desarrollar tu trayectoria profesional en un entorno innovador, cercano y referente en salud visual, MULTIÓPTICAS tiene la oportunidad perfecta. Únete a un equipo multidisciplinar donde la excelencia, el desarrollo y el trabajo humano son nuestro compromiso.

Únete a Multiópticas como Óptico/a Optometrista:

Buscamos Ópticos/as Optometristas en Santander, con vocación por la salud visual, atención y asesoramiento personalizado y entusiasmo por avanzar en el sector óptico. Forma parte de una empresa líder, con más de 40 años de experiencia, presencia nacional y compromiso con la innovación continua.

Responsabilidades clave del puesto:

Realizar exámenes visuales completos y pruebas de salud ocular a personas de todas las edades.

Adaptar y hacer el seguimiento de lentes de contacto, ofreciendo asesoramiento personalizado en salud visual y productos ópticos.

Asesorar a los clientes en la elección de gafas graduadas, monturas, lentes y productos de óptica adaptados a sus necesidades.

Colaborar en la gestión de operaciones diarias de la óptica, garantizando una experiencia positiva para quienes nos visitan.

Trabajar de forma coordinada con todo el equipo para alcanzar objetivos de calidad y satisfacción en cada servicio prestado.

Requisitos y perfil profesional:

Titulación universitaria en Óptica y Optometría, imprescindible para ejercer la profesión.

Experiencia previa en gabinete o establecimientos ópticos valorada, aunque consideramos perfiles junior con alta motivación.

Orientación al cliente, habilidad para el trato personal y compromiso con la excelencia en salud visual.

Destreza comunicativa, proactividad y capacidad de trabajo colaborativo.

Condiciones laborales y beneficios:

Jornada continua

Contrato estable en una empresa consolidada, referente en el sector óptico y de la salud visual.

Plan de formación inicial y desarrollo profesional continuo, con opciones de promoción interna.

Ambiente de trabajo cercano, multidisciplinar, con diversidad, igualdad de oportunidades y respeto.

Ubicación en el Centro Comercial Valle Real (Santander)

Crece como Óptico/a Optometrista con Multiópticas – Tu futuro profesional en el sector óptico

En Multiópticas apostamos por el talento, el compromiso y el desarrollo profesional, en un entorno que valora la diversidad y promueve la inclusión. Si quieres tener un impacto positivo en la salud visual de cientos de personas, crecer junto a un equipo de referencia y sentirte valorado/a cada día, te invitamos a formar parte de nuestro equipo, sin importar tu identidad o antecedentes. ¡Esperamos tu candidatura!

Únete a nosotros y haz brillar tu carrera como Óptico/a Optometrista en Multiópticas.",Santander,Todos
Mecánico/a,Domestiko,España,No especificado,+ 30 d,"3,9","Buscamos un/a profesional para la reparación y el mantenimiento de vehículos a motor en Santa María de Cayón.

Las tareas principales incluirán la diagnosis, reparación de averías mecánicas y eléctricas, así como el mantenimiento preventivo de todo tipo de vehículos. Se requiere experiencia demostrable en estas áreas.

Es necesario contar con el permiso de conducir B. Se ofrece una contratación inicial de tres meses a jornada completa, con la posibilidad de ampliarse a indefinido. El horario de trabajo será de 9:00 a 13:00 y de 15:00 a 19:00.",Santander,Todos
CREW sala,AmRest,España,No especificado,+ 30 d,"3,9","Responsabilidades
Atender y servir los pedidos a los clientes
Preparar deliciosos platos siguiendo nuestros altos estándares de calidad
Ofrecer un servicio excelente a nuestros clientes
Mantener en condiciones óptimas el lugar de trabajo
¿Qué buscamos?
Profesionales con experiencia que disfruten con la hostelería y les apasione la atención al cliente. Si es tu caso, ¡te estamos esperando!
Valorable experiencia en el sector, pero si no la tienes, no te preocupes: ¡Nosotros te formamos!
Compromiso y responsabilidad
Motivación por crecer dentro de nuestra marca
Disponibilidad horaria
Energía positiva
Orientación al cliente
Ganas de aprender
¿Qué te ofrecemos?
La posibilidad de hacer carrera dentro de la marca.
Poder moverte a otras empresas del Grupo.
Recibir una formación continua y especializada.
Programa de descuentos
Acceso a nuestra plataforma de idiomas",Santander,Todos
