Titulo,Empresa,Localizacion,Salario,Fecha_Publicacion,Valoracion_Empresa,Descripcion_Completa,Busqueda_Ciudad,Busqueda_Puesto
Portfolio Associate - Asset Management,"FUNDEEN PLATFORM, S.L.",España,No especificado,7 días,"3,2","¿Buscas un rol con impacto real, donde tu capacidad de organización y control sea clave para que las cosas funcionen? Sigue leyendo.

Fundeen es una startup fintech que está transformando la manera en la que las personas pueden invertir en proyectos relacionados con la transición energética y la sostenibilidad. A través de nuestra plataforma, facilitamos el acceso a oportunidades de coinversión en infraestructuras reales de energías renovables, con un enfoque firme en la transparencia, la trazabilidad y la simplicidad del proceso.

Combinamos tecnología, datos y rigor regulatorio con un propósito claro: permitir que más personas participen activamente en la transición hacia un modelo energético más sostenible. Y el modelo funciona. La comunidad crece, los proyectos aumentan y el impacto ambiental y social que generamos es cada vez más tangible y medible.

¿Qué buscamos?

Buscamos un Portfolio Associate – Asset Management en Ávila para llevar el seguimiento financiero y operativo de los activos en cartera.

Este rol es clave para garantizar que cada activo financiado cumple sus obligaciones económicas y contractuales. Y que los procesos que lo rodean están bien estructurados y listos para escalar.

¿Qué harás en tu día a día?

La posición combina seguimiento operativo, control financiero y coordinación legal, con una responsabilidad clara: que la gestión del portfolio sea rigurosa, ordenada y preparada para crecer.

Gestión operativa y legal de activos


Seguimiento societario de SPVs y participadas (juntas, acuerdos, transformaciones e hitos relevantes).
Coordinación con el equipo legal en cuestiones societarias, contractuales y regulatorias.
Gestión de incidencias legales u operativas.
Gestión financiera y deuda


Cálculo y seguimiento de management fees.
Cálculo y ejecución de distribuciones a inversores.
Seguimiento de deuda, covenants y calendarios de pago.
Coordinación con el equipo financiero para asegurar la correcta contabilización y tratamiento fiscal de las inversiones, garantizando coherencia entre la realidad económica del activo y el reporting al inversor.
Comunicación y gestión ESG


Elaboración y mantenimiento de calendarios de pago.
Redacción de actualizaciones periódicas sobre el desempeño financiero y operativo de los proyectos.
Seguimiento de seguros y coberturas del portfolio.
Coordinación y seguimiento del reporting ESG anual del portfolio.
Posible participación en la valoración ESG inicial de proyectos, en coordinación con el equipo de Inversiones.
Procesos y escalabilidad


Documentar y estructurar los procesos de gestión de activos.
Identificar oportunidades de estandarización y mejora.
Diseñar la estructura operativa e implementar los sistemas o herramientas de gestión que soportan el portfolio, facilitando su escalabilidad.
¿Qué buscamos?


3–5 años de experiencia en finanzas operativas, controlling, project finance, portfolio operations o funciones similares.
Experiencia trabajando con contratos financieros y seguimiento de obligaciones.
Perfil organizado, metódico y con atención al detalle.
Capacidad para gestionar tareas recurrentes de forma estructurada y trabajar con herramientas de gestión.
Buena capacidad de comunicación.
Formación


Grado en ADE, Finanzas, Gestión Empresarial o similar. Se valorará experiencia relevante en finanzas operativas o control de proyectos.
Lo que te llevarás de esta experiencia…


Impacto real: gestionarás activos vivos y tu trabajo tendrá efecto directo en la experiencia de nuestros inversores.
Aprendizaje continuo: tendrás exposición directa a financiación, estructuras societarias y gestión de portfolio.
Entorno dinámico: formarás parte de un proyecto en crecimiento donde verás cómo evoluciona el modelo y podrás contribuir a su mejora.
Un equipo excepcional: “buenos profesionales y mejores personas”, comprometido y con un propósito claro.
Y esto es solo el principio.

Beneficios pensados para ti


Contrato indefinido.
Un viernes libre al mes para desconectar.
Tu día de cumpleaños libre.
Horario flexible y modelo híbrido.
Programa de retribución flexible.
Tras un año con nosotros, un bono de 500 € para invertir en uno de los proyectos de la plataforma y vivir la experiencia Fundeen desde dentro.
Si te interesa formar parte de un proyecto donde finanzas, impacto y tecnología van de la mano, queremos conocerte.

Conoce más sobre nosotros en fundeen.com",Ávila,Todos
"Educador/a Social, indefinido, CAS MARINER",Grupo 5 (Spain),España,No especificado,23 días,"3,2","Descripción
Empresa

División otros servicios de AAPP

Puesto

Educador/a Social, indefinido, CAS MARINER

Tipo de oferta

Interna

Número de vacantes

1

Descripción de la oferta

Actualmente buscamos un/a educador/a social para nuestro centro situado en la localidad de Robledo de Chavela, dónde se desarrollarían las siguientes funciones:

Evalúa y planifica las necesidades educativas en colaboración con el equipo técnico.
Diseña, programa e imparte talleres y actividades en el centro y fuera del mismo.
Dinamiza el aula educativa.
Efectúa traslados y acompañamiento de usuarios.
Acompaña en la orientación e inserción laboral al usuario.
Regula e interviene en la convivencia diaria de los pacientes
Se coordina con la red comunitaria de entidades sociales, educativas… para dar respuesta a las necesidades de los usuarios.

Requisitos:

Grado en Educación social
Conocimiento en profundidad de su especialidad
Experiencia en trabajo en equipo interdisciplinar

Se ofrece:

Incorporación a empresa en gran expansión y con formación continua
Tipo de contrato: indefinido
Salario: según convenio
Horario: Jornada laboral de Lunes a Viernes. Turno de tarde de 15:00 a 22:00

Consulting tiene el compromiso de prestar las mismas oportunidades en los procesos de selección entre hombres y mujeres
Se valorará formación en Igualdad


Incorporación

04/05/2026


Fecha de publicación

03/02/2026

Fecha límite envio CV

04/05/2026",Ávila,Todos
INSTALLATIONS FOREMAN - ENCARGADO OBRA INSTALACIONES,Negratín,España,No especificado,6 días,"3,2","¡ÚNETE A NUESTRO EQUIPO!

Negratín está en búsqueda de un/a Encargado de obra de instalaciones para incorporarse a nuestro equipo de Instalaciones, liderando un importante proyecto de ubicado en Ávila.

Ubicación: Ávila

Departamento: Instalaciones

Incorporación: Inmediata

Reporta a: Jefe de obra

¿Cuál será tu misión?

Serás responsable de supervisar y gestionar la ejecución del proyecto.

¿Qué harás en tu día a día?


Supervisar la ejecución del proyecto asignado
Verificar que las instalaciones cumplen con los estándares de calidad y normativa vigente
Participar en la coordinación de equipos
Coordinar los recursos humanos, materiales y técnicos del proyecto
¿Qué te ofrecemos?


Participación en un importante proyecto de Instalaciones ubicado en Badajoz.
Estabilidad laboral dentro de una compañía referente en el sector de las instalaciones.
Desarrollo profesional y crecimiento interno.
Entorno técnico, dinámico y altamente especializado.
Condiciones económicas competitivas según experiencia.
Formación


CFGS en electricidad o climatización
Experiencia


Mínimo 5 años de experiencia como encargado de obra de instalaciones.
Experiencia en liderazgo de equipos multidisciplinares.
Experiencia en coordinación de subcontratas.
Valorable experiencia en proyectos de edificación singular.
Idiomas


No requerido.
En Negratín promovemos la igualdad de oportunidades, la diversidad y un entorno laboral inclusivo, garantizando procesos de selección libres de cualquier tipo de discriminación.

Negratín te está esperando.

¡Aplica ahora y forma parte de nuestro equipo!",Ávila,Todos
Fisioterapeuta Clínica Myfisiomilicias en Ávila,Myfisiomilicias,España,No especificado,10 días,"3,2","Fisioterapeuta para clínica privada en Ávila.

En clínica Myfisiomilicias buscamos un/a fisioterapeuta para incorporarse a nuestro equipo.

Ofrecemos:

Contrato por sustitución de embarazo y baja maternal de larga duración.
Jornada de 35 horas semanales, jornada continua de mañana en horario de 9 a 16h.
Salario según convenio + incentivos.
Buen ambiente de trabajo, dinámico y motivador.
Oportunidad de crecimiento profesional y formación continua.
Requisitos:

Grado en fisioterapia y formación continua.
Vocación, ganas de aprender y trabajar en equipo.
Se valorará experiencia en terapia manual, ejercicio terapéutico, punción seca, ... pero no es imprescindible.",Ávila,Todos
Jefe/a de Sector Retail - San Lorenzo de El Escorial,The Retail Performance Company,España,No especificado,+ 30 d,"3,2","Gran oportunidad profesional en el sector Retail

Una multinacional líder en retail está en búsqueda de un/a Retail Manager para Gran Superficie para su nueva apertura en San Lorenzo de El Escorial.

Buscamos a alguien con pasión, determinación y una gran capacidad de liderazgo para dirigir un equipo de más de 20 personas, inspirar con el ejemplo y llevar las operaciones comerciales al siguiente nivel.

Lo que harás

Liderar y motivar al equipo para superar objetivos de ventas y servicio.
Gestionar las operaciones diarias de tienda.
Analizar tendencias y aplicar estrategias para maximizar rentabilidad.
Optimizar la gestión de inventario y asegurar un merchandising efectivo.
Garantizar la mejor experiencia para cada cliente.

Lo que buscamos en ti

+5 años de experiencia en gestión de retail (idealmente en grandes superficies).
Experiencia liderando equipos grandes.
Perfil estratégico, orientado a resultados y con habilidades de comunicación excepcionales.
Residencia en Madrid o alrededores (o disponibilidad para trasladarse).

Lo que ofrecemos

Desarrollo profesional y capacitación continua.
Crecimiento dentro de una compañía multinacional referente en su sector.
Un entorno dinámico, innovador y retador.

¿Eres ese/a líder que buscamos? Si tienes la experiencia, las habilidades y la ambición necesarias, ¡es tu momento de dar el salto!",Ávila,Todos
Integrador/a social. centro de acogida para personas refugiadas. turno noche. el espinar (segovia),Cesal,El Espinar,18 mil € - 24 mil € (Proporcionado por la empresa),24 horas,"3,2","País
España
Provincia
El Espinar - Segovia
Fecha límite Inscripción
13/03/2026
Categoría
Atención Directa

Información de la ONG

CESAL
Valoración

(0 valoraciones)
info
% de respuesta: 63,16%
info

Objetivo





En CESAL buscamos incoporar integradores/as sociales al equipo de acogida e integración de personas refugiadas en turno de noche.


Se requiere disponibilidad para realizar turno de noche y disponer de carné de conducir B1.


Las funciones a desarrollar son:


Contribuir a la convivencia de las personas refugiadas residentes en el centro, favoreciendo el descanso en la noche, así como la correcta atención a necesidades que se puedan presentar durante la jornada, contribuyendo a implementar acciones que favorezcan el bienestar en todo el recinto, utilización y cuidado de espacios, entre otras


Realizar tareas de mediación entre personas y grupos aplicando técnicas participativas y de gestión de conflictos de forma eficiente


Valorar y atender posibles urgencias derivadas de la convivencia; así como otras que pudieran darse relativas al funcionamiento del centro o a las personas acogidas.


Realizar tareas administrativas propias del puesto y de apoyo al turno diurno.


Atención y seguimiento de actividades de ocio (videoforum, cine, etc.) que se puedan desarrollar en parte o en la totalidad en su turno.


Atención a los residentes madrugadores por exigencia formativas y laborales y atención a desayunos y/o cenas fuera de los horarios convencionales.




Perfil:

Grado Superior en Integración Social.

Experiencia con población migrante y/o refugiada.

Experiencia con población vulnerable.

Permiso de conducir B1.



Competencias:

Iniciativa y autonomía, Optimismo y entusiasmo, Organización y planificación, Comunicación interpersonal

Nivel:

Empleado

Tipo de contrato:

Jornada completa

Duración:

Indefinido

Salario:

Entre 18.001 y 24.000 € bruto/anual

Estudios mínimos:

Formación Profesional Grado Superior

Experiencia mínima:

Al menos 1 año

Fecha de inicio:

30/03/2026

Nº de vacantes:

1",Ávila,Todos
fisioterapeuta para trabajar en clínica en Avila,Centro de fisioterapia Cyriax,España,No especificado,+ 30 d,"3,2","Buscamos fisioterapeuta para trabajar en clínica privada en Avila. Ofrecemos jornada completa, continua así como sueldo por encima del convenio y buen ambiente de trabajo. Interesados mandar Cv a davidmerino0205@hotmail.com, o bien poniéndose en contacto en el 639967768",Ávila,Todos
Enfermero/a - DUE Centro Residencial DomusVi Decanos,DomusVi,España,No especificado,+ 30 d,"3,2","Descripción:

En DomusVi, cuidar es compartir humanidad, es crecer como profesional y formar parte de una labor que trasciende el día a día.

Buscamos profesionales que quieran ejercer con vocación, en un entorno donde la empatía, la innovación y el respeto forman parte de cada jornada.

¿Por qué DomusVi?

Porque somos la mayor red de centros y servicios sociosanitarios en España, con más de 28.000 profesionales comprometidos/as.

Trabajamos desde una visión cercana, profesional y humana, donde importa cada persona usuario/a, trabajador/a, familiar.

Nuestros valores nos definen:

El saber cuidar: ponemos conocimientos y humanidad al servicio del cuidado y el bienestar
Espíritu pionero: la innovación y la tecnología son parte de nuestro día a día.
Empatía innata: valoramos la escucha activa y afectiva.
Confianza compartida: promovemos relaciones basadas en el compromiso y la confianza mutua.
Sinceridad de las emociones: aportamos autenticidad a cada vínculo.

Lo que vas a encontrar en DomusVi

Una cultura centrada en el cuidado y respeto real de las personas. (usuarios/as, trabajadores/as, familias )
Un equipo interdisciplinar y colaborativo que te acompaña, escucha y con el que poder desarrollarte.
Estabilidad laboral y condiciones adaptadas a tus necesidades.
Tiempo para dedicar a lo que más importa: la atención de calidad.
Espacios para desarrollarte y crecer profesionalmente.

¿Qué harás como Enfermero/a - DUE?

Realizar las valoraciones de cuidados de enfermería en los ingresos de usuarios/as y las valoraciones periódicas establecidas.
Preparación y administración de medicamentos a las personas residentes siguiendo las prescripciones facultativas.
Realizar los cuidados paliativos: administración de mórficos y otras medicaciones paliativas.
Validar el plan de cuidados, curas, alimentación y farmacológico realizado en el seno del equipo interdisciplinar.
Incorporar al historial del residente las pautas y su evolución.
Facilitar apoyo moral y psicológico a residentes, así como atender consultas de familiares.
Supervisar los cuidados que realiza el personal auxiliar según pautas procedentes del equipo interdisciplinar .
Realización de tomas de INR (pruebas de coagulación) y control de INR (Sintrón), realizando las analíticas y el ajuste de dosis pautado por el/la médico/a.

Ofrecemos:

Contrato: temporal de 3 a 6 meses
Jornada: completa
Turnos: de 8 a 15 o de 15 a 22h
Incorporación: inmediata
Ambiente de trabajo: colaborativo y respetuoso
Conciliación laboral
Formación continua, Beneficios Sociales y Desarrollo Profesional: lo que te permitirá crecer en una empresa en constante evolución.

Requisitos:

Diplomatura /Grado en enfermería.
Deseable experiencia en entorno sociosanitario, hospitalario o residencial
A valorar positivamente, formación complementaria en igualdad o gerontología.

¿Te gustaría trabajar en un lugar donde tu vocación y tu desarrollo profesional van de la mano?

En DomusVi, compartimos humanidad y cuidamos tanto de quienes atendemos como de quienes forman parte de nuestro equipo.

¡Te esperamos!",Ávila,Todos
"MONITOR/A EN BAILE MODERNO (Colegio Público Felipe II, EL ESCORIAL)",Asociación Os Zagales,San Lorenzo de El Escorial,"9,52 € Por hora (Proporcionado por la empresa)",10 días,"3,2","Perfil requerido

Experiencia demostrable en impartición de baile moderno con infancia (Educación Primaria).
Valorable formación específica en danza, actividad física, educación o disciplinas afines.

Funciones principales

Diseño y desarrollo de sesiones dinámicas y adaptadas a la edad del grupo.
Fomento de valores como el respeto, la cooperación y la autoestima a través del movimiento.
Coordinación con el equipo responsable del servicio.

Condiciones

Contrato de 10 horas mensuales.
Incorporación en centro educativo público inmediata.
Entorno de trabajo estable y coordinado.

Tipo de puesto: Contrato temporal
Duración del contrato: 2 meses

Sueldo: 9,52€ la hora

Horas previstas: entre 2 y 3 a la semana

Ubicación del trabajo: Empleo presencial",Ávila,Todos
Fisioterapeuta,System Fisioterapia,España,No especificado,+ 30 d,"3,2","¡ÚNETE A SYSTEM FISIOTERAPIA!

¿Eres fisioterapeuta y buscas un lugar donde trabajar a gusto y crecer?
En System Fisioterapia te estamos buscando

Lo que ofrecemos:

Jornada completa o parcial (¡tú eliges!)
Jornada continua — ¡y los viernes por la tarde libre!
Fines de semana libres
Sueldo por encima de convenio
Días extra de vacaciones
Formación bonificada por la empresa
Oportunidades reales de crecimiento
Y un ambiente laboral increíble

Si te apasiona ayudar a las personas y quieres formar parte de un equipo joven y dinámico, ¡queremos conocerte!

Mándanos tu CV a info@systemfisioterapia.com",Ávila,Todos
SITE EHS OPERATIONS MANAGER,OPmobility,España,No especificado,16 días,"3,2","SITE EHS OPERATIONS MANAGER

Hungry for challenges? Join a group with innovation at its heart and contribute to the automotive revolution!
OPmobility is a world-leading provider of innovative solutions for a unique, safer and more sustainable mobility experience. Innovation-driven since its creation, the Group develops and produces intelligent exterior systems, customized complex modules, lighting systems, clean energy systems and electrification solutions for all mobility companies. With a €11.4 billion economic revenue in 2023, a global network of 152 plants and 40 R&D centers, OPmobility relies on its 40,300 employees to meet the challenges of transforming mobility.
A world leader in onboard energy storage and emission reduction systems, OPmobility C-Power develops solutions for all types of powertrains including, gasoline, diesel, hybrids, plug-in hybrids and battery electric vehicles. Electrification is the driver of low-carbon mobility and with the E-Power business, OPmobility is developing battery packs, electronics and power electronics for heavy-duty mobility and light vehicles.
Our ambition? Provide automakers with cutting-edge equipment and solutions to develop tomorrow’s clean and connected car.
MISSION: Ensure the health and safety of employees, as well as respect for the environment. Coordinate the Management System for Prevention, Environment, Energy Efficiency, and the HSEE activities, as well as Corporate Social Responsibility and biodiversity initiatives carried out at the Plant
RESPONSIBILITIES AND ACTIVITIES
HSE Plant Manager:
Identify and communicate to all relevant departments the legal requirements regarding occupational risk prevention and environmental protection, as well as the Group’s standards, promoting and ensuring strict compliance with them.
Collaborate with the Occupational Health & Safety Service in the identification and assessment of risks, as well as in specific hygiene and ergonomics assessments.
Identify and assess the potential environmental impacts of the Plant.
Define, together with the Plant Director, operational controls and the planning of HSE activities, ensuring their compliance to prevent accidents, occupational illnesses, and environmental incidents.
Promote and deliver training on Safety and Environmental matters.
Organize the AFA Day.
Fulfill the legal obligation to provide information, consultation, and worker participation through the Health & Safety Committee or safety representatives.
Disseminate required HSE information across different internal and external levels and areas.
Conduct Safety and Environmental inspections/audits, propose corrective actions, and monitor their implementation.
Manage accidents, incidents, and non-conformities, investigate root causes, and determine corrective/preventive actions in collaboration with the relevant departments.
Monitor and report incidents and other HSE indicators at Plant and Group level.
Ensure compliance with the contractor coordination procedure for subcontractors and temporary workers regarding HSE matters.
Attend visits/inspections from public authorities related to HSE and respond, when necessary, to any official requirements received.
Manage hazardous and non-hazardous waste generated by the Plant, carry out operational controls, and prepare and submit official environmental documentation.
Procure and manage the necessary Personal Protective Equipment (PPE).
Coordinate the actions and activities of the External Prevention Service as well as the Mutual Insurance entities.
Participate in multidisciplinary teams involved in the industrialization of new processes, providing HSE expertise to eliminate at source any potential risks or environmental impacts.
Implement and maintain the Safety and Environmental Management System at the plant, ensuring its effective application, archiving, and controlling all required documentation.
Manage and participate in internal and external HSE System audits.
Apply Lean Manufacturing and Continuous Improvement principles.
Ensure responsibility for the application of LOTO – Lock Out Tag Out procedures
Inergo Leader
Conduct ergonomic assessments of workstations using the Inergo method.
Coordinate specialized ergonomic studies carried out by external companies when necessary.
Advise management and propose preventive, corrective, or improvement measures in ergonomics, as well as monitor the corresponding Action Plan.
Participate in new layouts or process changes to review ergonomic aspects.
Manage the Inergo database, ensuring proper recording of completed studies.
Define training and awareness needs in Ergonomics and inform the HR Department for inclusion in the annual training plan.
Deliver basic Ergonomics training to all workstations.
Participate in all “Inergo” meetings that take place.
Participate in the review of Alphavision studies conducted by the Group, when required.
Monitor and report the Plant’s Ergonomics indicators to Management and participate in the annual HSE System Review.
Corporate Social Responsibility (CSR) and Biodiversity
Propose CSR and Biodiversity actions to be carried out by the plant to meet Group objectives.
Develop or collaborate with HR in the execution of the planned actions.
Report the actions carried out to the Group in accordance with the established procedure.
Top Planet: Energy Management System Leader
Participate in and promote actions to reduce energy consumption in order to improve the carbon footprint.
Lead CSR-related actions.
Act as the direct liaison between top management, organizational personnel, and external entities.


Profile :
Master PRL (Prevención de Riesgos Laborales)
Engineering Education background
at least 3 year experience in an industrial environment
Good command of English


As a responsible company, OPmobility pays particular attention to diversity and equality within its teams and the Group commits to treat all job applications equally.
Date: Feb 10, 2026
Location: Arevalo, ES
Job Requisition ID: 388484",Ávila,Todos
